ResponseId,scenario,answerOrder,morality,normality,probability,question,rationality,time
R_1CkCWTVcfGzYD25,scenario1,1,Strongly Disagree,Strongly Disagree,Strongly Disagree,look to find any interactive exhibits,Strongly Disagree,26.089
R_1CkCWTVcfGzYD25,scenario1,2,Strongly Disagree,Strongly Disagree,Strongly Disagree,View the permanent exhibits,Strongly Disagree,21.734
R_1CkCWTVcfGzYD25,scenario1,3,Strongly Disagree,Strongly Disagree,Strongly Disagree,play with or work the interactive exhibits,Strongly Disagree,31.245
R_1CkCWTVcfGzYD25,scenario1,4,Strongly Disagree,Strongly Disagree,Strongly Disagree,"Visit the gift shop to see if there are brochures or maps to the museum, to make sure I see it all.",Strongly Disagree,32.662
R_1CkCWTVcfGzYD25,scenario1,5,Strongly Disagree,Strongly Disagree,Strongly Disagree,See whether there is a movie theatre in the museum (As in the natural history museum in Albuquerque  NM).,Strongly Disagree,58.141
R_1CkCWTVcfGzYD25,scenario1,6,Strongly Disagree,Strongly Disagree,Strongly Disagree,Watch the IMAX presentation if the museum has a theatre,Strongly Disagree,21.782
R_1CkCWTVcfGzYD25,scenario1,7,Strongly Disagree,Strongly Disagree,Disagree,Have a cup of tea in the museum's gift shop/cafe,Disagree,27.59
R_1CkCWTVcfGzYD25,scenario1,8,Strongly Disagree,Strongly Disagree,Strongly Disagree,"Make some drawings of exhibits I like, i.e., native american dwellings or village exhibits",Disagree,36.148
R_1FD26cuU4g8OehX,scenario1,1,Strongly Disagree,Strongly Disagree,Strongly Disagree,I could walk around and look at the exhibits. ,Strongly Disagree,11.05
R_1FD26cuU4g8OehX,scenario1,2,Strongly Disagree,Strongly Disagree,Disagree,I could sit down at a bench and relax for awhile. ,Strongly Disagree,11.763
R_1FD26cuU4g8OehX,scenario1,3,Strongly Disagree,Disagree,Somewhat Agree,I could talk to other people about the exhibits and make a new friend. ,Disagree,11.43
R_1FD26cuU4g8OehX,scenario1,4,Strongly Disagree,Strongly Disagree,Disagree,I could visit the gift shop and find a postcard. ,Strongly Disagree,13.484
R_1FD26cuU4g8OehX,scenario1,5,Disagree,Disagree,Agree,I could visit the bathrooms to splash water on my face and freshen up.,Disagree,19.971
R_1FD26cuU4g8OehX,scenario1,6,Disagree,Agree,Strongly Agree,I could run around the room screaming if I did not care about being kicked out. ,Strongly Agree,38.132
R_1FD26cuU4g8OehX,scenario1,7,Strongly Disagree,Strongly Disagree,Somewhat Disagree,I could look out the window to see what the weather is. ,Disagree,54.574
R_1FD26cuU4g8OehX,scenario1,8,Strongly Disagree,Somewhat Agree,Strongly Agree,I could walk around in circles if I want. ,Agree,41.082
R_1fkhiLIX6aOEIPh,scenario1,1,Strongly Disagree,Strongly Disagree,Strongly Disagree,Look at paintings.,Strongly Disagree,4.031
R_1fkhiLIX6aOEIPh,scenario1,2,Strongly Disagree,Strongly Disagree,Strongly Disagree,Look at sculptures.,Strongly Disagree,4.534
R_1fkhiLIX6aOEIPh,scenario1,3,Strongly Disagree,Strongly Disagree,Strongly Disagree,Look at art installations.,Strongly Disagree,4.153
R_1fkhiLIX6aOEIPh,scenario1,4,Strongly Disagree,Strongly Disagree,Strongly Disagree,Talk to museum patrons.,Strongly Disagree,5.896
R_1fkhiLIX6aOEIPh,scenario1,5,Strongly Disagree,Strongly Disagree,Strongly Disagree,Talk to museum curators.,Strongly Disagree,4.287
R_1fkhiLIX6aOEIPh,scenario1,6,Disagree,Neutral,Neutral,Watch other people.,Disagree,4.098
R_1fkhiLIX6aOEIPh,scenario1,7,Strongly Disagree,Strongly Disagree,Strongly Disagree,Look at exhibits.,Strongly Disagree,6.534
R_1fkhiLIX6aOEIPh,scenario1,8,Strongly Disagree,Strongly Disagree,Strongly Disagree,Go to the bathroom.,Strongly Disagree,3.943
R_1gLQ25ALBFem7jJ,scenario1,1,Strongly Disagree,Strongly Agree,Strongly Disagree,I could take pictures of various items on display at the museum with my phone.,Strongly Disagree,23.79
R_1gLQ25ALBFem7jJ,scenario1,2,Strongly Disagree,Strongly Disagree,Somewhat Disagree,I could wonder why I had to leave my backpack at the coat check and ponder if something bad has happened at the museum in which they had to enact this policy.,Strongly Disagree,63.221
R_1gLQ25ALBFem7jJ,scenario1,3,Somewhat Agree,Agree,Strongly Agree,I could wonder if everything would still be in backpack and if I actually had to leave it if I insisted to take it in instead.,Somewhat Agree,26.673
R_1gLQ25ALBFem7jJ,scenario1,4,Strongly Disagree,Strongly Disagree,Disagree,I could ask the guides more about some of the exhibits in the museum and thier history relating to the items.,Strongly Disagree,47.435
R_1gLQ25ALBFem7jJ,scenario1,5,Disagree,Somewhat Disagree,Somewhat Agree,I could inquire about how to get a job in the museum from other workers there.,Disagree,62.384
R_1gLQ25ALBFem7jJ,scenario1,6,Strongly Disagree,Strongly Disagree,Disagree,I could try and make friends with other visitors who look like they have similar interests.,Strongly Disagree,29.601
R_1gLQ25ALBFem7jJ,scenario1,7,Strongly Disagree,Strongly Disagree,Strongly Disagree,I could learn as much as I could about the history of the museum itself.,Strongly Disagree,45.209
R_1gLQ25ALBFem7jJ,scenario1,8,Disagree,Disagree,Somewhat Agree,I could audio record the presentations from the guides to help me remember what I learned.,Strongly Disagree,66.848
R_1imVtppPmFBmcgr,scenario1,1,Strongly Disagree,Strongly Disagree,Strongly Disagree,Enjoy sculpture,Strongly Disagree,8.074
R_1imVtppPmFBmcgr,scenario1,2,Strongly Disagree,Strongly Disagree,Strongly Disagree,Look at paintings,Strongly Disagree,6.388
R_1imVtppPmFBmcgr,scenario1,3,Strongly Disagree,Strongly Disagree,Strongly Disagree,Spend time in the courtyard,Strongly Disagree,8.712
R_1imVtppPmFBmcgr,scenario1,4,Strongly Disagree,Strongly Disagree,Strongly Disagree,See different genres of art,Strongly Disagree,8.33
R_1imVtppPmFBmcgr,scenario1,5,Strongly Disagree,Strongly Disagree,Strongly Disagree,See artifacts,Strongly Disagree,6.74
R_1imVtppPmFBmcgr,scenario1,6,Strongly Disagree,Strongly Disagree,Strongly Disagree,See natural history exhibits,Strongly Disagree,12.318
R_1imVtppPmFBmcgr,scenario1,7,Strongly Disagree,Strongly Disagree,Strongly Disagree,See traveling exhibits,Strongly Disagree,7.848
R_1imVtppPmFBmcgr,scenario1,8,Strongly Disagree,Strongly Disagree,Strongly Disagree,Learn about artists,Strongly Disagree,5.253
R_1JQsNRgY0ZZKmfX,scenario1,1,Strongly Disagree,Strongly Disagree,Disagree,Look at historical exhibits.,Strongly Disagree,14
R_1JQsNRgY0ZZKmfX,scenario1,2,Disagree,Disagree,Neutral,Use the restroom.,Disagree,7.552
R_1JQsNRgY0ZZKmfX,scenario1,3,Somewhat Disagree,Disagree,Somewhat Agree,Take selfies in the exhibits.,Neutral,14.753
R_1JQsNRgY0ZZKmfX,scenario1,4,Strongly Disagree,Disagree,Agree,Meet some history buffs who are also there.,Somewhat Disagree,19.204
R_1JQsNRgY0ZZKmfX,scenario1,5,Disagree,Somewhat Disagree,Agree,Talk to the security guards.,Somewhat Disagree,8.315
R_1JQsNRgY0ZZKmfX,scenario1,6,Somewhat Agree,Agree,Agree,Run through the hallways between exhibits.,Agree,15.369
R_1JQsNRgY0ZZKmfX,scenario1,7,Somewhat Agree,Somewhat Agree,Agree,Argue with my wife over which exhibits are better.,Somewhat Disagree,16.599
R_1JQsNRgY0ZZKmfX,scenario1,8,Strongly Disagree,Strongly Disagree,Strongly Disagree,Learn about history.,Strongly Disagree,5.374
R_1LO4n3To983qGbQ,scenario1,1,Strongly Disagree,Strongly Disagree,Somewhat Disagree,Worry about my backpack,Somewhat Agree,7.987
R_1LO4n3To983qGbQ,scenario1,2,Strongly Disagree,Disagree,Agree,spend less time there,Somewhat Agree,8.143
R_1LO4n3To983qGbQ,scenario1,3,Strongly Disagree,Strongly Disagree,Somewhat Agree,forget where you left your bag,Disagree,15.721
R_1LO4n3To983qGbQ,scenario1,4,Strongly Disagree,Strongly Disagree,Disagree,not worry about losing your bag since its checked in,Disagree,18.903
R_1LO4n3To983qGbQ,scenario1,5,Strongly Disagree,Strongly Disagree,Disagree,spend longer than you planned,Disagree,10.114
R_1LO4n3To983qGbQ,scenario1,6,Strongly Disagree,Strongly Disagree,Disagree,enjoy yourself more,Disagree,7.14
R_1LO4n3To983qGbQ,scenario1,7,Strongly Disagree,Strongly Disagree,Somewhat Disagree,get distracted ,Disagree,12.937
R_1LO4n3To983qGbQ,scenario1,8,Strongly Disagree,Strongly Disagree,Disagree,eat something,Disagree,11.686
R_1mrdT8hIWdQtg8h,scenario1,1,Strongly Disagree,Strongly Disagree,Strongly Disagree,view art,Strongly Disagree,4.544
R_1mrdT8hIWdQtg8h,scenario1,2,Strongly Disagree,Strongly Disagree,Disagree,sit down,Strongly Disagree,4.374
R_1mrdT8hIWdQtg8h,scenario1,3,Strongly Disagree,Strongly Disagree,Strongly Disagree,read,Strongly Disagree,4.723
R_1mrdT8hIWdQtg8h,scenario1,4,Strongly Disagree,Strongly Disagree,Strongly Disagree,walk,Strongly Disagree,3.42
R_1mrdT8hIWdQtg8h,scenario1,5,Strongly Disagree,Strongly Disagree,Disagree,gift shop,Strongly Disagree,5.067
R_1mrdT8hIWdQtg8h,scenario1,6,Strongly Disagree,Strongly Disagree,Disagree,buy stuff,Strongly Disagree,4.165
R_1mrdT8hIWdQtg8h,scenario1,7,Strongly Disagree,Strongly Disagree,Strongly Disagree,bathroom break,Strongly Disagree,6.735
R_1mrdT8hIWdQtg8h,scenario1,8,Strongly Disagree,Strongly Disagree,Strongly Disagree,wash hands,Strongly Disagree,2.76
R_1MXmDtVDFsdHn2i,scenario1,1,Strongly Disagree,Strongly Disagree,Strongly Disagree,take my coat to the coat check and go see an exhibit,Strongly Disagree,23.447
R_1MXmDtVDFsdHn2i,scenario1,2,Strongly Disagree,Strongly Disagree,Strongly Disagree,walk around and find an exhibit that interests me,Strongly Disagree,19.781
R_1MXmDtVDFsdHn2i,scenario1,3,Strongly Disagree,Strongly Disagree,Strongly Disagree,take photo of an interesting exhibit,Strongly Disagree,11.801
R_1MXmDtVDFsdHn2i,scenario1,4,Strongly Disagree,Strongly Disagree,Strongly Disagree,film something interesting that I see,Strongly Disagree,13.074
R_1MXmDtVDFsdHn2i,scenario1,5,Strongly Disagree,Strongly Disagree,Strongly Disagree,Find out new information about something that interests me,Strongly Disagree,16.631
R_1MXmDtVDFsdHn2i,scenario1,6,Strongly Disagree,Strongly Disagree,Strongly Disagree,take photos of myself at the museum,Strongly Disagree,17.492
R_1MXmDtVDFsdHn2i,scenario1,7,Strongly Disagree,Strongly Disagree,Strongly Disagree,visit a museum gift store,Strongly Disagree,12.125
R_1MXmDtVDFsdHn2i,scenario1,8,Strongly Disagree,Strongly Disagree,Strongly Disagree,take notes about a new and interesting topic,Strongly Disagree,16.157
R_1n0DtBQv5LwRTWE,scenario1,1,Strongly Disagree,Strongly Disagree,Disagree,I could check out the exhibits.,Strongly Disagree,19.342
R_1n0DtBQv5LwRTWE,scenario1,2,Strongly Disagree,Neutral,Agree,I could people watch.,Strongly Disagree,7.971
R_1n0DtBQv5LwRTWE,scenario1,3,Strongly Disagree,Strongly Disagree,Strongly Disagree,I could learn about something new.,Strongly Disagree,11.704
R_1n0DtBQv5LwRTWE,scenario1,4,Strongly Disagree,Neutral,Strongly Agree,I could fantasize what it would be like to live in olden times.,Somewhat Agree,26.913
R_1n0DtBQv5LwRTWE,scenario1,5,Strongly Disagree,Strongly Disagree,Agree,I could wonder about why I can't bring my bag.,Strongly Disagree,20.616
R_1n0DtBQv5LwRTWE,scenario1,6,Strongly Disagree,Strongly Disagree,Strongly Agree,I could try to count the dinosaur bones.,Neutral,21.025
R_1n0DtBQv5LwRTWE,scenario1,7,Strongly Disagree,Strongly Disagree,Agree,I could look for the dining area.,Strongly Agree,12.203
R_1n0DtBQv5LwRTWE,scenario1,8,Strongly Disagree,Strongly Disagree,Strongly Disagree,I could sign up for future tours.,Strongly Disagree,10.107
R_1ptjoIFw8Iu1tov,scenario1,1,Strongly Disagree,Strongly Disagree,Strongly Disagree,check my backpack,Strongly Disagree,7.711
R_1ptjoIFw8Iu1tov,scenario1,2,Strongly Disagree,Strongly Disagree,Strongly Disagree,put the check ticket in my pocket,Strongly Disagree,13.092
R_1ptjoIFw8Iu1tov,scenario1,3,Strongly Disagree,Strongly Disagree,Strongly Disagree,pick up a map of the museum,Strongly Disagree,7.667
R_1ptjoIFw8Iu1tov,scenario1,4,Strongly Disagree,Strongly Disagree,Strongly Disagree,look for interesting exhibits,Strongly Disagree,10.857
R_1ptjoIFw8Iu1tov,scenario1,5,Strongly Disagree,Strongly Disagree,Strongly Disagree,head toward points of interest,Strongly Disagree,8.243
R_1ptjoIFw8Iu1tov,scenario1,6,Strongly Disagree,Strongly Disagree,Strongly Disagree,stay quiet so as to not disturb others,Strongly Disagree,9.834
R_1ptjoIFw8Iu1tov,scenario1,7,Strongly Disagree,Strongly Disagree,Strongly Disagree,admire the exhibits,Strongly Disagree,8.481
R_1ptjoIFw8Iu1tov,scenario1,8,Strongly Disagree,Strongly Disagree,Strongly Disagree,learn some new information,Strongly Disagree,8.362
R_1rk9AThXrUoDhId,scenario1,1,Strongly Disagree,Strongly Disagree,Disagree,check my backpack,Disagree,8.856
R_1rk9AThXrUoDhId,scenario1,2,Strongly Disagree,Strongly Disagree,Disagree,buy a ticket,Disagree,5.466
R_1rk9AThXrUoDhId,scenario1,3,Disagree,Disagree,Disagree,pick up a brochure,Disagree,7.301
R_1rk9AThXrUoDhId,scenario1,4,Disagree,Disagree,Disagree,look at the map of exhibits,Disagree,16.991
R_1rk9AThXrUoDhId,scenario1,5,Strongly Disagree,Strongly Disagree,Strongly Disagree,explore the museum,Strongly Disagree,12.708
R_1rk9AThXrUoDhId,scenario1,6,Strongly Disagree,Strongly Disagree,Disagree,find the museum cafe,Somewhat Disagree,12.862
R_1rk9AThXrUoDhId,scenario1,7,Disagree,Disagree,Disagree,buy something in the gift shop,Disagree,9.562
R_1rk9AThXrUoDhId,scenario1,8,Strongly Disagree,Strongly Disagree,Strongly Disagree,learn about the things in the museum,Strongly Disagree,9.489
R_21v20zJEEHivjcG,scenario1,1,Strongly Disagree,Strongly Disagree,Strongly Disagree,Look at the exhibits,Strongly Disagree,13.145
R_21v20zJEEHivjcG,scenario1,2,Strongly Disagree,Strongly Disagree,Strongly Disagree,Buy a souvenir. ,Strongly Disagree,18.104
R_21v20zJEEHivjcG,scenario1,3,Strongly Disagree,Strongly Disagree,Strongly Disagree,Buy a snack,Strongly Disagree,5.813
R_21v20zJEEHivjcG,scenario1,4,Strongly Disagree,Strongly Disagree,Disagree,Use the rest room,Disagree,5.37
R_21v20zJEEHivjcG,scenario1,5,Disagree,Strongly Disagree,Strongly Disagree,Buy a bottle of water,Disagree,9.386
R_21v20zJEEHivjcG,scenario1,6,Disagree,Disagree,Somewhat Disagree,Watch a TV show,Disagree,5.632
R_21v20zJEEHivjcG,scenario1,7,Disagree,Strongly Disagree,Disagree,Sit on the chair,Disagree,9.185
R_21v20zJEEHivjcG,scenario1,8,Somewhat Agree,Somewhat Agree,Agree,Read a book.,Agree,9.035
R_22Lo9BlToxIk3Hw,scenario1,1,Strongly Disagree,Strongly Disagree,Strongly Disagree,say no,Strongly Disagree,7.604
R_22Lo9BlToxIk3Hw,scenario1,2,Strongly Disagree,Strongly Disagree,Strongly Disagree,explain my medical disability requires my medical bag at all times,Strongly Disagree,21.032
R_22Lo9BlToxIk3Hw,scenario1,3,Neutral,Agree,Somewhat Disagree,suddenly die,Disagree,18.66
R_22Lo9BlToxIk3Hw,scenario1,4,Somewhat Agree,Somewhat Disagree,Strongly Agree,leave the bag and look at art,Strongly Agree,14.605
R_22Lo9BlToxIk3Hw,scenario1,5,Strongly Disagree,Somewhat Disagree,Somewhat Agree,leave the museum,Strongly Disagree,5.273
R_22Lo9BlToxIk3Hw,scenario1,6,Strongly Disagree,Strongly Disagree,Strongly Disagree,order coffee in the cafe,Strongly Disagree,8.649
R_22Lo9BlToxIk3Hw,scenario1,7,Strongly Disagree,Strongly Disagree,Strongly Disagree,talk to people,Strongly Disagree,7.719
R_22Lo9BlToxIk3Hw,scenario1,8,Strongly Disagree,Strongly Disagree,Somewhat Disagree,get a guided tour,Strongly Disagree,5.614
R_24BJGFhufjl9UhI,scenario1,1,Strongly Disagree,Strongly Disagree,Disagree,find a  map of the museum,Strongly Disagree,17.764
R_24BJGFhufjl9UhI,scenario1,2,Strongly Disagree,Strongly Disagree,Somewhat Agree,speak to an employee for recommendations,Strongly Disagree,25.513
R_24BJGFhufjl9UhI,scenario1,3,Strongly Disagree,Strongly Disagree,Strongly Disagree,check out the exhibits,Strongly Disagree,8.134
R_24BJGFhufjl9UhI,scenario1,4,Strongly Disagree,Strongly Disagree,Disagree,look around the gift shop,Strongly Disagree,12.299
R_24BJGFhufjl9UhI,scenario1,5,Strongly Disagree,Strongly Disagree,Strongly Disagree,use the restroom,Strongly Disagree,7.932
R_24BJGFhufjl9UhI,scenario1,6,Strongly Disagree,Somewhat Disagree,Agree,chat with other patrons,Strongly Disagree,9.656
R_24BJGFhufjl9UhI,scenario1,7,Strongly Disagree,Somewhat Disagree,Somewhat Agree,take photos,Strongly Disagree,19.737
R_24BJGFhufjl9UhI,scenario1,8,Strongly Disagree,Strongly Disagree,Strongly Disagree,learn about new things,Strongly Disagree,9.879
R_27HEXQGC24Mpolu,scenario1,1,Strongly Disagree,Strongly Disagree,Strongly Disagree,go to the gift shop,Strongly Disagree,8.092
R_27HEXQGC24Mpolu,scenario1,2,Strongly Disagree,Strongly Disagree,Disagree,check out their art section,Strongly Disagree,13.091
R_27HEXQGC24Mpolu,scenario1,3,Strongly Disagree,Strongly Disagree,Strongly Disagree,see if they have a food court or cafe and relax,Strongly Disagree,16.093
R_27HEXQGC24Mpolu,scenario1,4,Strongly Disagree,Strongly Disagree,Disagree,walk through different sections to find one you really like,Strongly Disagree,13.595
R_27HEXQGC24Mpolu,scenario1,5,Strongly Disagree,Strongly Disagree,Strongly Disagree,check out the dinosaur fossil section,Strongly Disagree,11.411
R_27HEXQGC24Mpolu,scenario1,6,Strongly Disagree,Disagree,Somewhat Agree,make small talk with people looking at certain displays,Disagree,17.123
R_27HEXQGC24Mpolu,scenario1,7,Disagree,Somewhat Disagree,Neutral,take photos if that is allowed,Disagree,7.76
R_27HEXQGC24Mpolu,scenario1,8,Strongly Disagree,Strongly Disagree,Agree,leave the museum if you find you are bored and go do something else,Strongly Disagree,19.449
R_2A0wqMmsro7R1r0,scenario1,1,Strongly Disagree,Strongly Disagree,Neutral,look at art,Strongly Disagree,11.857
R_2A0wqMmsro7R1r0,scenario1,2,Strongly Disagree,Strongly Disagree,Neutral,walk around for exercise,Disagree,43.566
R_2A0wqMmsro7R1r0,scenario1,3,Neutral,Agree,Neutral,play a prank on security,Neutral,8.666
R_2A0wqMmsro7R1r0,scenario1,4,Strongly Disagree,Strongly Disagree,Disagree,take pictures,Strongly Disagree,37.429
R_2A0wqMmsro7R1r0,scenario1,5,Strongly Disagree,Strongly Disagree,Somewhat Agree,meet other people,Disagree,23.424
R_2A0wqMmsro7R1r0,scenario1,6,Strongly Disagree,Strongly Disagree,Strongly Disagree,educate myself,Strongly Disagree,132.107
R_2A0wqMmsro7R1r0,scenario1,7,Strongly Disagree,Somewhat Disagree,Neutral,sit down and relax,Strongly Disagree,9.831
R_2A0wqMmsro7R1r0,scenario1,8,Strongly Disagree,Strongly Disagree,Strongly Disagree,reflect on the past,Strongly Disagree,15.532
R_2cbAPRW722dq3Gm,scenario1,1,Strongly Disagree,Strongly Disagree,Strongly Disagree,walk around,Strongly Disagree,4.879
R_2cbAPRW722dq3Gm,scenario1,2,Strongly Disagree,Strongly Disagree,Strongly Disagree,look at artwork,Strongly Disagree,5.717
R_2cbAPRW722dq3Gm,scenario1,3,Strongly Disagree,Strongly Disagree,Strongly Disagree,look at historical items,Strongly Disagree,6.977
R_2cbAPRW722dq3Gm,scenario1,4,Strongly Disagree,Strongly Disagree,Strongly Disagree,read plaque information,Strongly Disagree,12.883
R_2cbAPRW722dq3Gm,scenario1,5,Strongly Disagree,Strongly Disagree,Strongly Disagree,listen to an audio presentation,Strongly Disagree,7.463
R_2cbAPRW722dq3Gm,scenario1,6,Strongly Disagree,Strongly Disagree,Disagree,visit with the security guard,Strongly Disagree,19.514
R_2cbAPRW722dq3Gm,scenario1,7,Strongly Disagree,Strongly Disagree,Strongly Disagree,talk with other people,Strongly Disagree,5.529
R_2cbAPRW722dq3Gm,scenario1,8,Strongly Disagree,Strongly Disagree,Strongly Disagree,buy a souvenir,Strongly Disagree,5.398
R_2CfU9To2UYrD8zp,scenario1,1,Strongly Disagree,Strongly Disagree,Strongly Disagree,Check out all the items the museum has,Strongly Disagree,10.867
R_2CfU9To2UYrD8zp,scenario1,2,Strongly Disagree,Strongly Disagree,Agree,text my friends,Disagree,5.491
R_2CfU9To2UYrD8zp,scenario1,3,Strongly Disagree,Strongly Disagree,Agree,check email,Somewhat Agree,4.107
R_2CfU9To2UYrD8zp,scenario1,4,Strongly Disagree,Strongly Disagree,Disagree,take pictures of exhibits,Disagree,7.987
R_2CfU9To2UYrD8zp,scenario1,5,Strongly Disagree,Strongly Disagree,Strongly Agree,read the news on my phone,Agree,8.388
R_2CfU9To2UYrD8zp,scenario1,6,Strongly Disagree,Strongly Disagree,Strongly Agree,play a game on phone,Strongly Agree,6.713
R_2CfU9To2UYrD8zp,scenario1,7,Strongly Disagree,Strongly Disagree,Somewhat Disagree,eat a snack,Disagree,5.945
R_2CfU9To2UYrD8zp,scenario1,8,Strongly Disagree,Strongly Disagree,Somewhat Disagree,talk to the museum employees,Strongly Disagree,9.515
R_2dMekOKukSD5cQF,scenario1,1,Strongly Disagree,Strongly Disagree,Strongly Disagree,Enjoy the exhibits.,Strongly Disagree,66.8
R_2dMekOKukSD5cQF,scenario1,2,Strongly Disagree,Strongly Disagree,Strongly Disagree,Learn about culture and history,Strongly Disagree,21.571
R_2dMekOKukSD5cQF,scenario1,3,Strongly Disagree,Strongly Disagree,Strongly Disagree,Broaden my mind,Strongly Disagree,14.075
R_2dMekOKukSD5cQF,scenario1,4,Strongly Disagree,Strongly Disagree,Disagree,Ask questions about things I'm interested in,Strongly Disagree,18.116
R_2dMekOKukSD5cQF,scenario1,5,Strongly Disagree,Strongly Disagree,Strongly Disagree,Discover interests I didn't know I had,Strongly Disagree,22.485
R_2dMekOKukSD5cQF,scenario1,6,Strongly Disagree,Strongly Disagree,Strongly Disagree,Plan the rest of my day,Strongly Disagree,40.139
R_2dMekOKukSD5cQF,scenario1,7,Strongly Disagree,Strongly Disagree,Strongly Disagree,Space out and not really think about my problems,Strongly Disagree,10.26
R_2dMekOKukSD5cQF,scenario1,8,Strongly Disagree,Strongly Disagree,Strongly Disagree,Walk around,Strongly Disagree,51.531
R_2froWw5vs2b6AxH,scenario1,1,Disagree,Disagree,Strongly Disagree,I would leave my backpack with the security guard.,Strongly Disagree,42.769
R_2froWw5vs2b6AxH,scenario1,2,Disagree,Disagree,Strongly Disagree,I would look at the exhibits.,Disagree,18.16
R_2froWw5vs2b6AxH,scenario1,3,Strongly Disagree,Disagree,Strongly Disagree,I may watch a movie or film.,Disagree,27.482
R_2froWw5vs2b6AxH,scenario1,4,Strongly Disagree,Disagree,Somewhat Disagree,I would probably ask questions about the exhibits.,Disagree,23.763
R_2froWw5vs2b6AxH,scenario1,5,Strongly Disagree,Strongly Disagree,Disagree,I may get a snack or drink.,Strongly Disagree,20.273
R_2froWw5vs2b6AxH,scenario1,6,Strongly Disagree,Strongly Disagree,Strongly Disagree,I would have fun looking at the exhibits.,Disagree,25.168
R_2froWw5vs2b6AxH,scenario1,7,Disagree,Disagree,Strongly Disagree,I would read information provided about the exhibits.,Strongly Disagree,46.642
R_2froWw5vs2b6AxH,scenario1,8,Strongly Disagree,Strongly Disagree,Disagree,I would visit with family or friends that I met there.,Strongly Disagree,26.766
R_2S0IYfBDVyAiCJ5,scenario1,1,Strongly Disagree,Strongly Disagree,Strongly Disagree,look at art,Strongly Disagree,7.179
R_2S0IYfBDVyAiCJ5,scenario1,2,Strongly Disagree,Strongly Disagree,Strongly Disagree,look at fossils,Strongly Disagree,7.17
R_2S0IYfBDVyAiCJ5,scenario1,3,Strongly Disagree,Strongly Disagree,Strongly Disagree,look at exhibits,Strongly Disagree,13.785
R_2S0IYfBDVyAiCJ5,scenario1,4,Strongly Disagree,Strongly Disagree,Strongly Disagree,have a seat on a bench,Strongly Disagree,9.336
R_2S0IYfBDVyAiCJ5,scenario1,5,Strongly Disagree,Strongly Disagree,Strongly Disagree,visit the gift shop,Strongly Disagree,11.119
R_2S0IYfBDVyAiCJ5,scenario1,6,Strongly Disagree,Strongly Disagree,Strongly Disagree,explore,Strongly Disagree,7.787
R_2S0IYfBDVyAiCJ5,scenario1,7,Strongly Disagree,Strongly Disagree,Strongly Disagree,have fun,Strongly Disagree,4.501
R_2S0IYfBDVyAiCJ5,scenario1,8,Strongly Disagree,Strongly Disagree,Strongly Disagree,learn,Strongly Disagree,2.073
R_2s5yhsQZDSPebac,scenario1,1,Strongly Disagree,Strongly Disagree,Strongly Disagree,look at displays,Strongly Disagree,6.644
R_2s5yhsQZDSPebac,scenario1,2,Strongly Disagree,Strongly Disagree,Strongly Disagree,take photos,Strongly Disagree,3.472
R_2s5yhsQZDSPebac,scenario1,3,Disagree,Disagree,Disagree,youtube livestream,Neutral,5.365
R_2s5yhsQZDSPebac,scenario1,4,Strongly Disagree,Strongly Disagree,Strongly Disagree,talk someone,Strongly Disagree,8.092
R_2s5yhsQZDSPebac,scenario1,5,Strongly Disagree,Somewhat Agree,Disagree,record my voice on phone as I look around,Neutral,157.983
R_2s5yhsQZDSPebac,scenario1,6,Strongly Disagree,Disagree,Strongly Disagree,find the area I like go there immediately ,Disagree,13.505
R_2s5yhsQZDSPebac,scenario1,7,Strongly Disagree,Neutral,Somewhat Agree,take photos with friends in pictures,Neutral,13.148
R_2s5yhsQZDSPebac,scenario1,8,Strongly Disagree,Strongly Disagree,Strongly Disagree,go to eating area,Strongly Disagree,6.774
R_2ToAyr7ZiTE6L9D,scenario1,1,Disagree,Disagree,Disagree,Walk around.,Disagree,15.971
R_2ToAyr7ZiTE6L9D,scenario1,2,Strongly Disagree,Strongly Disagree,Strongly Disagree,Look at the displays.,Strongly Disagree,16.392
R_2ToAyr7ZiTE6L9D,scenario1,3,Disagree,Disagree,Disagree,Meet a friend.,Disagree,17.16
R_2ToAyr7ZiTE6L9D,scenario1,4,Disagree,Somewhat Disagree,Somewhat Disagree,Eat a snack.,Disagree,107.481
R_2ToAyr7ZiTE6L9D,scenario1,5,Disagree,Somewhat Disagree,Somewhat Disagree,Kill time.,Disagree,15.622
R_2ToAyr7ZiTE6L9D,scenario1,6,Disagree,Somewhat Disagree,Somewhat Disagree,Watch the other people.,Disagree,17.86
R_2ToAyr7ZiTE6L9D,scenario1,7,Disagree,Somewhat Disagree,Disagree,Check your phone for messages.,Disagree,24.339
R_2ToAyr7ZiTE6L9D,scenario1,8,Disagree,Somewhat Disagree,Disagree,Check emails.,Disagree,17.134
R_2uUkS0ZBSZsjJoi,scenario1,1,Strongly Disagree,Strongly Disagree,Strongly Disagree,I would give them my backpack,Strongly Disagree,7.715
R_2uUkS0ZBSZsjJoi,scenario1,2,Strongly Disagree,Strongly Disagree,Agree,I did leave the museum and go take my backpack back home,Agree,8.417
R_2uUkS0ZBSZsjJoi,scenario1,3,Agree,Neutral,Strongly Agree,I would tell the guard that I have an oxygen machine in my backpack that keeps me alive,Agree,11.829
